{
  "scaena": "0.35",
  "title": "Manifest stops shippers paying for freight they never shipped",
  "canvas": [
    1920.0,
    1080.0
  ],
  "formats": [],
  "spine": {
    "sections": [
      {
        "id": "problem",
        "title": "Problem",
        "beats": [
          {
            "id": "manifest-stops-shippers-paying-for-freight-they-never-sh",
            "claim": "Manifest stops shippers paying for freight they never shipped",
            "states": [
              "manifest-stops-shippers-paying-for"
            ],
            "notes": "- Thanks for the time. We’re Manifest, and we audit every freight invoice before it gets paid.\n- We’re raising a $4M seed to take what worked in our pilots to the mid-market.\n- Fifteen minutes: the problem, what it costs, why today’s fixes fail, and what we built.",
            "duration": 41.0,
            "media": {
              "narrato": {
                "layout": "Title",
                "beatIndex": 0,
                "beatName": "Problem",
                "purpose": "Names the company and the promise in one line",
                "intent": "Make them curious why freight invoices need auditing",
                "intensity": 0.3,
                "valence": 0.1,
                "visual": "A loading dock at dawn, trucks backed into bays, a single invoice glowing on a tablet in the foreground"
              }
            }
          },
          {
            "id": "one-in-twelve-freight-invoices-is-wrong-and-nobody-check",
            "claim": "One in twelve freight invoices is wrong, and nobody checks",
            "states": [
              "one-in-twelve-freight-invoices"
            ],
            "notes": "- Here’s the uncomfortable truth we found in every pilot.\n- About 8% of freight invoices carry an error, almost always in the carrier’s favor.\n- A shipper moving 20,000 loads a year can’t read every line, so they don’t.\n- They pay what they’re billed and hope the carrier got it right.",
            "duration": 34.0,
            "media": {
              "narrato": {
                "layout": "Statement",
                "beatIndex": 0,
                "beatName": "Problem",
                "purpose": "States the core problem as a single hard fact",
                "intent": "Make them feel the scale of unchecked overbilling",
                "intensity": 0.6,
                "valence": -0.4,
                "visual": "A stack of thousands of invoices on a desk, one highlighted in red, the rest blurring into shadow"
              }
            }
          }
        ]
      },
      {
        "id": "impact",
        "title": "Impact",
        "beats": [
          {
            "id": "billing-errors-drain-9-billion-from-us-shippers-every-ye",
            "claim": "Billing errors drain $9 billion from US shippers every year",
            "states": [
              "billing-errors-drain-9-billion"
            ],
            "notes": "- We took the error rate from 2.1 million invoices we audited and applied it to US freight spend.\n- That’s $9 billion a year, paid and never recovered.\n- For a typical mid-market shipper, that’s $400K to $1.2M walking out the door.\n- And nobody on their team owns finding it.",
            "duration": 39.0,
            "media": {
              "narrato": {
                "layout": "Big Number",
                "beatIndex": 1,
                "beatName": "Impact",
                "purpose": "Quantifies the cost of inaction with a single dollar figure",
                "intent": "Make them feel that ignoring this is itself expensive",
                "intensity": 0.85,
                "valence": -0.7,
                "visual": "A single enormous dollar figure over a highway at night, trucks streaking past as light trails",
                "fact": "Manifest analysis of 2.1M invoices from 38 pilot shippers, applied to $1.1T US freight spend"
              }
            }
          },
          {
            "id": "accessorial-charges-cause-most-of-the-overbilling-we-fou",
            "claim": "Accessorial charges cause most of the overbilling we found",
            "evidence": [
              "@accessorial-charges-cause-most-of-data"
            ],
            "notes": "- Accessorials are the extras: liftgates, detention, residential delivery.\n- They’re billed after the fact and rarely match the contract.\n- Duplicates are next: the same load billed twice through two channels.\n- Rate drift is the quiet one: last year’s rate, this year’s invoice.",
            "duration": 38.0,
            "media": {
              "narrato": {
                "layout": "Bar Chart",
                "beatIndex": 1,
                "beatName": "Impact",
                "purpose": "Shows where the money leaks so the problem feels concrete",
                "intent": "Make them believe the errors are systematic, not random",
                "intensity": 0.7,
                "valence": -0.5
              }
            }
          }
        ]
      },
      {
        "id": "existing-approaches",
        "title": "Existing Approaches",
        "beats": [
          {
            "id": "we-knew-we-were-overpaying-but-couldn-t-afford-to-find-o",
            "claim": "We knew we were overpaying but couldn’t afford to find out",
            "states": [
              "we-knew-we-were-overpaying"
            ],
            "notes": "Dana runs logistics for a $600M food distributor. Before Manifest, her team of four sampled two hundred invoices a month out of nine thousand. She knew the money was there; she had no way to get it without hiring an audit firm that would take a third of it.",
            "duration": 43.0,
            "media": {
              "narrato": {
                "layout": "Quote",
                "beatIndex": 2,
                "beatName": "Existing Approaches",
                "purpose": "Gives the problem a human voice from a real buyer",
                "intent": "Make them feel the buyer's frustration with the status quo",
                "intensity": 0.65,
                "valence": -0.5,
                "visual": "Portrait of a logistics manager in a warehouse office, invoices pinned to a corkboard behind her"
              }
            }
          },
          {
            "id": "audit-firms-recover-money-months-late-and-keep-a-third-o",
            "claim": "Audit firms recover money months late and keep a third of it",
            "states": [
              "audit-firms-recover-money-months"
            ],
            "notes": "| | Audit firms | Manifest |\n| --- | --- | --- |\n| Speed | 45–60 days after payment | Before payment |\n| Cost | 30–50% contingency | Flat per-invoice fee |\n| Coverage | Sampled | Every invoice |",
            "duration": 45.0,
            "media": {
              "narrato": {
                "layout": "VS",
                "beatIndex": 2,
                "beatName": "Existing Approaches",
                "purpose": "Shows why the incumbents cannot fix this",
                "intent": "Make them see a gap the incumbents structurally cannot close",
                "intensity": 0.6,
                "valence": -0.2
              }
            }
          }
        ]
      },
      {
        "id": "audit-every-invoice-before-it-is-paid",
        "title": "Audit every invoice before it is paid",
        "beats": [
          {
            "id": "audit-every-invoice-before-it-is-paid",
            "claim": "Audit every invoice before it is paid",
            "states": [
              "audit-every-invoice-before-it"
            ],
            "notes": "- So we built the audit that happens before the money moves.\n- Let me show you how it works.",
            "duration": 18.0,
            "media": {
              "narrato": {
                "layout": "Section Header",
                "beatIndex": 3,
                "beatName": "Solution",
                "purpose": "Turns the deck from problem to solution",
                "intent": "Signal that the answer is coming",
                "intensity": 0.5,
                "valence": 0.5,
                "visual": "A single invoice on a dark background, a green check mark drawing itself across it"
              }
            }
          },
          {
            "id": "manifest-checks-each-invoice-against-the-contract-in-sec",
            "claim": "Manifest checks each invoice against the contract in seconds",
            "states": [
              "manifest-checks-each-invoice-against"
            ],
            "notes": "- Three steps, all automatic.\n- We read every invoice format carriers send, including scanned PDFs.\n- We match each charge to the contract and to what actually happened on the dock.\n- When something’s wrong, we file the dispute with evidence attached.\n- AP only ever sees verified amounts.",
            "duration": 59.0,
            "media": {
              "narrato": {
                "layout": "How It Works",
                "beatIndex": 3,
                "beatName": "Solution",
                "purpose": "Explains the mechanism so the claim feels credible",
                "intent": "Make them believe the product is real and simple to adopt",
                "intensity": 0.6,
                "valence": 0.5,
                "visual": "A clean three-panel diagram: an invoice, a contract, and a dispute email connected by glowing lines"
              }
            }
          },
          {
            "id": "audit-moves-from-months-after-payment-to-seconds-before",
            "claim": "Audit moves from months after payment to seconds before it",
            "states": [
              "audit-moves-from-months-after"
            ],
            "notes": "- This is the shift that matters.\n- Recovery after payment is slow, adversarial, and expensive.\n- Prevention before payment is fast and the carrier usually just reissues the invoice.\n- Our pilots disputed before payment 94% of the time.",
            "duration": 36.0,
            "media": {